UC-8

mysql> describe employee_payroll;
+-------------+--------------+------+-----+---------+----------------+
| Field       | Type         | Null | Key | Default | Extra          |
+-------------+--------------+------+-----+---------+----------------+
| id          | int unsigned | NO   | PRI | NULL    | auto_increment |
| name        | varchar(15)  | NO   |     | NULL    |                |
| phoneNumber | int          | YES  |     | NULL    |                |
| gender      | varchar(6)   | YES  |     | NULL    |                |
| salary      | double       | NO   |     | NULL    |                |
| start       | date         | NO   |     | NULL    |                |
| phone       | varchar(30)  | NO   |     | NULL    |                |
| department  | varchar(30)  | NO   |     | NULL    |                |
| address     | varchar(30)  | NO   |     | Umred   |                |
+-------------+--------------+------+-----+---------+----------------+
9 rows in set (0.00 sec)

mysql> select * from Employee_Payroll;
+----+--------+-------------+--------+--------+------------+-------+------------+-----------+
| id | name   | phoneNumber | gender | salary | start      | phone | department | address   |
+----+--------+-------------+--------+--------+------------+-------+------------+-----------+
|  1 | Bharti |        NULL | Female |  30000 | 2022-03-04 |       |            | Bangalore |
|  2 | Arati  |        NULL | Female |  50000 | 2022-05-12 |       |            | Bangalore |
|  3 | Shamal |        NULL | Female |  40000 | 2023-08-09 |       |            | Bangalore |
|  4 | Harsh  |        NULL | Male   |  50000 | 2022-04-05 |       |            | Bangalore |
+----+--------+-------------+--------+--------+------------+-------+------------+-----------+
4 rows in set (0.00 sec)

mysql> alter table employee_payroll
    -> modify phonenumber
    -> Varchar(20);
Query OK, 4 rows affected (0.06 sec)
Records: 4  Duplicates: 0  Warnings: 0

mysql>  update employee_payroll set phonenumber = '8908641811'
    ->  where name = 'Shamal';
Query OK, 1 row affected (0.02 sec)
Rows matched: 1  Changed: 1  Warnings: 0

mysql> update employee_payroll set phonenumber = '7008458748'
    -> where name = 'Arati';
Query OK, 1 row affected (0.02 sec)
Rows matched: 1  Changed: 1  Warnings: 0

mysql> update employee_payroll set phonenumber = '8168458748'
    -> where name = 'Bharti';
Query OK, 1 row affected (0.02 sec)
Rows matched: 1  Changed: 1  Warnings: 0

mysql>  update employee_payroll set phonenumber = '8978458748'
    -> where name = 'Harsh';
Query OK, 1 row affected (0.00 sec)
Rows matched: 1  Changed: 1  Warnings: 0

mysql> select * from Employee_Payroll;
+----+--------+-------------+--------+--------+------------+-------+------------+-----------+
| id | name   | phonenumber | gender | salary | start      | phone | department | address   |
+----+--------+-------------+--------+--------+------------+-------+------------+-----------+
|  1 | Bharti | 8168458748  | Female |  30000 | 2022-03-04 |       |            | Bangalore |
|  2 | Arati  | 7008458748  | Female |  50000 | 2022-05-12 |       |            | Bangalore |
|  3 | Shamal | 8908641811  | Female |  40000 | 2023-08-09 |       |            | Bangalore |
|  4 | Harsh  | 8978458748  | Male   |  50000 | 2022-04-05 |       |            | Bangalore |
+----+--------+-------------+--------+--------+------------+-------+------------+-----------+
4 rows in set (0.00 sec)

mysql> update employee_payroll set address = 'Bangalore'
    ->  where name = 'Bharti' or name = 'Arati' or name = 'Shamal' or name = 'Harsh';
Query OK, 0 rows affected (0.00 sec)
Rows matched: 4  Changed: 0  Warnings: 0

mysql> select * from Employee_Payroll;
+----+--------+-------------+--------+--------+------------+-------+------------+-----------+
| id | name   | phonenumber | gender | salary | start      | phone | department | address   |
+----+--------+-------------+--------+--------+------------+-------+------------+-----------+
|  1 | Bharti | 8168458748  | Female |  30000 | 2022-03-04 |       |            | Bangalore |
|  2 | Arati  | 7008458748  | Female |  50000 | 2022-05-12 |       |            | Bangalore |
|  3 | Shamal | 8908641811  | Female |  40000 | 2023-08-09 |       |            | Bangalore |
|  4 | Harsh  | 8978458748  | Male   |  50000 | 2022-04-05 |       |            | Bangalore |
+----+--------+-------------+--------+--------+------------+-------+------------+-----------+
4 rows in set (0.00 sec)

mysql>  update employee_payroll set department = 'Devloper'
    -> where name = 'Bharti';
Query OK, 1 row affected (0.02 sec)
Rows matched: 1  Changed: 1  Warnings: 0

mysql>  update employee_payroll set department = 'Testing'
    -> where name = 'Arati';
Query OK, 1 row affected (0.02 sec)
Rows matched: 1  Changed: 1  Warnings: 0

mysql>  update employee_payroll set department = 'Production'
    -> where name = 'Shamal';
Query OK, 1 row affected (0.00 sec)
Rows matched: 1  Changed: 1  Warnings: 0

mysql>  update employee_payroll set department = 'Analyst'
    -> where name = 'Harsh';
Query OK, 1 row affected (0.02 sec)
Rows matched: 1  Changed: 1  Warnings: 0

mysql>  select * from Employee_Payroll;
+----+--------+-------------+--------+--------+------------+-------+------------+-----------+
| id | name   | phonenumber | gender | salary | start      | phone | department | address   |
+----+--------+-------------+--------+--------+------------+-------+------------+-----------+
|  1 | Bharti | 8168458748  | Female |  30000 | 2022-03-04 |       | Devloper   | Bangalore |
|  2 | Arati  | 7008458748  | Female |  50000 | 2022-05-12 |       | Testing    | Bangalore |
|  3 | Shamal | 8908641811  | Female |  40000 | 2023-08-09 |       | Production | Bangalore |
|  4 | Harsh  | 8978458748  | Male   |  50000 | 2022-04-05 |       | Analyst    | Bangalore |
+----+--------+-------------+--------+--------+------------+-------+------------+-----------+
4 rows in set (0.00 sec)



uc-9-Ability to extend employee_payroll table to have Basic Pay, Deductions, Taxable Pay, Income Tax, Net Pay


mysql>  alter table employee_payroll add basicpay Double NOT NULL after salary;
Query OK, 0 rows affected (0.01 sec)
Records: 0  Duplicates: 0  Warnings: 0

mysql> alter table employee_payroll add deduction Double NOT NULL after basicpay;
Query OK, 0 rows affected (0.01 sec)
Records: 0  Duplicates: 0  Warnings: 0

mysql> alter table employee_payroll add taxablepay Double NOT NULL after deduction;
Query OK, 0 rows affected (0.03 sec)
Records: 0  Duplicates: 0  Warnings: 0

mysql> alter table employee_payroll add incometax Double NOT NULL after taxablepay;
Query OK, 0 rows affected (0.03 sec)
Records: 0  Duplicates: 0  Warnings: 0

mysql> alter table employee_payroll add netpay Double NOT NULL after incometax;
Query OK, 0 rows affected (0.03 sec)
Records: 0  Duplicates: 0  Warnings: 0

mysql> describe employee_payroll;
+-------------+--------------+------+-----+---------+----------------+
| Field       | Type         | Null | Key | Default | Extra          |
+-------------+--------------+------+-----+---------+----------------+
| id          | int unsigned | NO   | PRI | NULL    | auto_increment |
| name        | varchar(15)  | NO   |     | NULL    |                |
| phonenumber | varchar(20)  | YES  |     | NULL    |                |
| gender      | varchar(6)   | YES  |     | NULL    |                |
| salary      | double       | NO   |     | NULL    |                |
| basicpay    | double       | NO   |     | NULL    |                |
| deduction   | double       | NO   |     | NULL    |                |
| taxablepay  | double       | NO   |     | NULL    |                |
| incometax   | double       | NO   |     | NULL    |                |
| netpay      | double       | NO   |     | NULL    |                |
| start       | date         | NO   |     | NULL    |                |
| phone       | varchar(30)  | NO   |     | NULL    |                |
| department  | varchar(30)  | NO   |     | NULL    |                |
| address     | varchar(30)  | NO   |     | Umred   |                |
+-------------+--------------+------+-----+---------+----------------+
14 rows in set (0.00 sec)

mysql> select * from Employee_Payroll;
+----+--------+-------------+--------+--------+----------+-----------+------------+-----------+--------+------------+-------+------------+-----------+
| id | name   | phonenumber | gender | salary | basicpay | deduction | taxablepay | incometax | netpay | start      | phone | department | address   |
+----+--------+-------------+--------+--------+----------+-----------+------------+-----------+--------+------------+-------+------------+-----------+
|  1 | Bharti | 8168458748  | Female |  30000 |        0 |         0 |          0 |         0 |      0 | 2022-03-04 |       | Devloper   | Bangalore |
|  2 | Arati  | 7008458748  | Female |  50000 |        0 |         0 |          0 |         0 |      0 | 2022-05-12 |       | Testing    | Bangalore |
|  3 | Shamal | 8908641811  | Female |  40000 |        0 |         0 |          0 |         0 |      0 | 2023-08-09 |       | Production | Bangalore |
|  4 | Harsh  | 8978458748  | Male   |  50000 |        0 |         0 |          0 |         0 |      0 | 2022-04-05 |       | Analyst    | Bangalore |
+----+--------+-------------+--------+--------+----------+-----------+------------+-----------+--------+------------+-------+------------+-----------+
4 rows in set (0.01 sec)

mysql>  update employee_payroll set basicpay = '13700', deduction = '2000', taxablepay = '1500', incometax = '1500', netpay = '11300'
    -> where name = 'Bharti';
Query OK, 1 row affected (0.01 sec)
Rows matched: 1  Changed: 1  Warnings: 0

mysql> update employee_payroll set basicpay = '12000', deduction = '1800', taxablepay = '1300', incometax = '1300', netpay = '13400'
    ->  where name = 'Arati';
Query OK, 1 row affected (0.02 sec)
Rows matched: 1  Changed: 1  Warnings: 0

mysql> update employee_payroll set basicpay = '15000', deduction = '2200', taxablepay = '2000', incometax = '2000', netpay = '10800'
    ->  where name = 'Shamal';
Query OK, 1 row affected (0.02 sec)
Rows matched: 1  Changed: 1  Warnings: 0

mysql>  update employee_payroll set basicpay = '15000', deduction = '2200', taxablepay = '2000', incometax = '1600', netpay = '10000'
    ->  where name = 'Harsh';
Query OK, 1 row affected (0.02 sec)
Rows matched: 1  Changed: 1  Warnings: 0

mysql> select * from Employee_Payroll;
+----+--------+-------------+--------+--------+----------+-----------+------------+-----------+--------+------------+-------+------------+-----------+
| id | name   | phonenumber | gender | salary | basicpay | deduction | taxablepay | incometax | netpay | start      | phone | department | address   |
+----+--------+-------------+--------+--------+----------+-----------+------------+-----------+--------+------------+-------+------------+-----------+
|  1 | Bharti | 8168458748  | Female |  30000 |    13700 |      2000 |       1500 |      1500 |  11300 | 2022-03-04 |       | Devloper   | Bangalore |
|  2 | Arati  | 7008458748  | Female |  50000 |    12000 |      1800 |       1300 |      1300 |  13400 | 2022-05-12 |       | Testing    | Bangalore |
|  3 | Shamal | 8908641811  | Female |  40000 |    15000 |      2200 |       2000 |      2000 |  10800 | 2023-08-09 |       | Production | Bangalore |
|  4 | Harsh  | 8978458748  | Male   |  50000 |    15000 |      2200 |       2000 |      1600 |  10000 | 2022-04-05 |       | Analyst    | Bangalore |
+----+--------+-------------+--------+--------+----------+-----------+------------+-----------+--------+------------+-------+------------+-----------+
4 rows in set (0.00 sec)
